claim,evidence,estimator,effect,significance_or_status,verdict
Elixir's ACB leaderboard advantage is real after artifact controls.,ACB-Full reproduction + Suite H artifact controls,Observed minus difficulty/length-adjusted expectation,+42.7 points versus difficulty+question-length expected rate,Large and stable across all artifact controls,strong
"Within Elixir, documentation structure materially drives performance.",Suite A paper-grade active ablation,Paired delta versus full_docs,minimal_docs -38.4 points; signature_only -41.4 points,Holm-adjusted p < 1e-15,strong
Examples alone explain Elixir's advantage.,Suite A paper-grade active ablation,reference_no_examples versus full_docs,0.0 point delta,No effect,not_established
"Concrete examples directionally help the matched panel, but not cleanly for every language.",Explicit-task panel (48 matched language-task pairs),Paired sign test for rich_contract_examples versus baseline_compact,"7 improvements, 2 degradations, mean delta +0.104",Exact two-sided sign p = 0.179688; low-power directional result,directional
Elixir universally dominates once tasks are tightly matched.,Explicit-task cross-language panel,Per-language pass rate on the 144-row panel,"Elixir 64.6%, Python 81.2%, TypeScript 83.3%",Contradicted on the current matched panel,not_established
Control-flow explicitness is the primary isolated driver.,Suite D paper-grade ablation + leave-one-out proxy analysis,Paired deltas and correlation sensitivity,All suite deltas within +/-3 points,Not Holm-significant; outlier-sensitive proxy,not_established
Explicit result contracts and state flow are helpful secondary contributors.,Suites E and F,Paired deltas versus baseline,Tagged tuples +3.0; state-flow variants +5.1 to +5.6,Directional only after Holm correction,directional
